{
  "schema": "hebrinex.binding",
  "schema_version": 1,
  "project_id": "PRJ-00000000000000000000000000000000",
  "instance_id": "INST-00000000000000000000000000000000",
  "project_root": "<absolute-project-root>",
  "layout": "central_instance",
  "instance_relative_path": ".hebrinex/instance",
  "required_engine": {
    "api_line": "1",
    "minimum_engine_version": "0.17.1"
  },
  "state_schema_version": 1,
  "created_at": "1970-01-01T00:00:00.0000000Z",
  "updated_at": "1970-01-01T00:00:00.0000000Z"
}
